,product,title,rating,body
15,Sony Alpha 7C Full-Frame Compact Mirrorless Camera Kit - Silver (ILCE7CL/S),Great compact travel camera,5.0,"There are many technical reviews on this camera that is better than anything I can say here.  I wanted a camera mainly for video and would like to share how I came to chose the 7c.  There are lots of other choices, but this checks all the important marks that I was looking for.  I started fresh without any prior lens and accessories.  I first evaluated which brand and system of camera I want.  The industry is moving towards larger full frame sensors.  There's Sony, Canon, and Fuji.  I feel that Sony is the leader in product development and innovation.  So I went with them.  I could have bought the 7siii, but the 7c is much much more compact and at this point fits my need.  I could have chosen the a6600, but I think the full frames have better picture, especially in low light.  And is a better upgrade path towards other Sony full frames in the future.  I could have gone with a GH5, but that's a much larger camera with sucky focus and low light performance.  And though I like Canon, they don't have a full frame in this size.  They have better lens selection for sure, but I feel they are not quite as innovative.So for my compact video travel rig, I have the 7c with one set of lens...the Tamron 17-14mm.  For audio I bought the Sony eco-81m shotgun mic.  This mic operates in digital mode, and powers off the 7c battery so no extra cord or battery to worry about.  So far it's been the perfect system for me.  I do have larger hands so the grip is just a bit small.  I ended getting the Smallrig cage. I was worried this might add bulk to my system, but it fits like a glove and adds no perceivable bulk.  It adds protection as well as gives me a much better grip surface.I love my set up.  It has everything I want in a travel video camera."
16,Sony Alpha 7C Full-Frame Compact Mirrorless Camera Kit - Silver (ILCE7CL/S),Compact full-frame and full-featured travel camera with great build quality and choice of lenses,5.0,"Sony's Alpha series is highly regarded by both professionals and enthusiasts. The 7C is a wonderful new entry in its product portfolio targeted towards vloggers, travel enthusiasts, influencers, or even professionals who would like to have an additional camera handy.It ticks many important boxes - light and well made, 4k video, compact mirrorless, full-frame, enough controls for the serious photographer, and compatibility with Sony's wide selection of E-mount lenses. External microphone and lights can be easily added, and a good quality company tripod should be fine.The form-factor on this is ideal for travel. I am still trying this out, but so far have been very happy with stills and video. This will definitely be my go-to outdoors and travel camera (when travel resumes). Highly recommended.Update 1 - I took the camera on a couple of local trips and love how easy it is to carry around. This is definitely much easier to carry around, both in dimensions and weight, compared to other DSLRs. I tend to shoot more because of this. You still have the full-frame capabilities capturing excellent photos and videos. The a7c is perfectly suited for travel, hiking, and vlogging with great autofocus and continuous eye tracking. The kit lens (28-60) does an adequate job with portrait stills and bokeh shots when traveling light, but thanks to Sony's extensive range of high-quality E-mount lenses I have also paired it with some Sony G Master series lenses for even better photo results. The audio capture is good and it's easy to add an external travel mic for pro results.  Pasr19"
17,Sony Alpha 7C Full-Frame Compact Mirrorless Camera Kit - Silver (ILCE7CL/S),Excellent for its design!,4.0,"Bought this not too long ago and I was a Sony Alpha 7R II user. I believe Sony's design vision came out great. I thought back then that A7R2 will be my camera for a while but as I grow as a photographer, I realized that the weight and the AF system were not my taste anymore. I couldn't really go to APS-C because, the 35mm sensor size simply gives honor to film sizes and I respect that. Imagine, a (relatively) smaller form factor, with full-frame image size capability, enough superb resolution (24MP) for current viewing/display technology (and possibly in the coming years later) and competitive color science. All packed in A7C. Not to mention, great battery life. The price could've been cheaper, for all the compromises done. Lesser buttons? Not a big deal; loss of quality of life I suppose. One can always master their gear and be faster in changing settings than anyone else, no matter how less of buttons there are. In note of color science, I shoot RAW so it is irrelevant to me. If I want to better color, I'll work the image in post processing. I'd say Sony Alpha 7C is Excellent for its design! But in the end of the day, only yourself can decide which to purchase; you have to be sure how is it going to be used for anyway."
18,Sony Alpha 7C Full-Frame Compact Mirrorless Camera Kit - Silver (ILCE7CL/S),Not impressed,2.0,This is a wonderfully adequate camera.  The kit lens feels cheap and plastic.  The body is better.  I have found the A7iii a better buy.  The camera really does not have a small camera feel.  Nothing really impressive for the money.
19,Sony Alpha 7C Full-Frame Compact Mirrorless Camera Kit - Silver (ILCE7CL/S),"Nice smaller & lighter, great for travel and day trips",4.0,"The Sony Alpha 7C takes great crisp clear photos & video.  I love the smaller size, it makes it so much easier for making videos.  The smaller size also makes it easier to use on smaller tripods like I use for my unboxing videos, so I can get close up.  Since it is also lighter it will make it easier to use on a hand held device for my outdoor videos opposed to the large DSLR I have tried to use.  I am really impressed with the quality and ease of use of this Sony Alpha 7C.  I am also in love with being able to change out the lenses, that makes it so versatile for the different types of videos that I make.  Anything from content creating to my own personal family fun videos & cooking videos.  It is a great little camera and very versatile.  I can't wait to get a couple more lenses and really do more with it.  I think the Sony Alpha 7C is going to make a great travel camera as well.  It will be easier to pack and carry in my bag instead of having to carry an extra bag with my larger heavy DSLR."
20,Sony Alpha 7C Full-Frame Compact Mirrorless Camera Kit - Silver (ILCE7CL/S),Small and mighty! Amazing full frame camera,5.0,"Wow I feel like I am emerging from the Stone Age! This camera has amazing features and makes taking amazing shots and videos a breeze. I had heard a lot about the Sony mirrorless cameras but hadn’t had a chance to try one out but with the release of the A7c it was the perfect balance of price and features that I had to go for it! The real time tracking autofocus system is truly amazing and very fast allowing for fast capture of clear shots. I also really liked the 4K video recording and the inputs for a mic and headphones allowing clean audio recording with the video. This would be a great camera for anybody looking to take amazing photos and videos on the go. The size is great for travel it is almost pocketable and the kit lens has a great range. The collapsable zoom lens helped keep the form factor small and balanced with the size of the camera. I loved the silver and black color scheme for its retro feel but with modern technology. Coming from a APS-C camera, the amount of details and the dynamic range that is captured by this full frame is amazing. I didn’t think it would be that big of a difference but I can really tell the difference it image quality between this full frame and my old APS-C. The bokeh is mind blowing! No portrait mode on a phone can compete, the software makes it very easy to get studio quality results and always gets the subject in focus with the right amount of background blur. I would highly recommend it for any beginner photographer or somebody who travels a lot and wants something that can be tossed into and bag or large jacket pocket. You really can’t beat the size of this camera especially with a full frame lens, it’s almost the same size as the old digital point and shoots we all used to have."
21,Sony Alpha 7C Full-Frame Compact Mirrorless Camera Kit - Silver (ILCE7CL/S),Fantastic little full frame,5.0,It has the full frame image quality that I was after at a smaller size compared to the A7iii. Fantastic battery and great lineup of lenses. I only wish it had the new and improved menu system that the A7siii has.
22,Sony Alpha 7C Full-Frame Compact Mirrorless Camera Kit - Silver (ILCE7CL/S),Great Portable Camera. Lots in a (relatively) small  package,5.0,"This camera is spectacular. I am a casual photography enthusiast. I thought I'd use this camera to shoot more food / cocktail photography but instead I've been using it for portrait and animal photography over the holidays. I've used the video to film fireworks and family time to put the camera to the test in different situations and scenarios. I've tested the camera in motion and in night with mostly stills and briefly used the video.Below is my comprehensive review of the Sony A7CAesthetic and Body: Absolutely beautiful casing with a retro feel. The silver and black feels like I'm shooting on a gorgeous vintage leica with a fuller body, The weight is actually incredible. So light to carry around. I've shot on a DSLR traditionally and am surprised at how much this camera delivers in the size of its body. It's got a great ergonomic grip that allows for stable shooting. Huge Kudos to Sony on the design of the a7c. Some have said that the viewfinder seems small, I disagree. It is perfectly ergonomic and fits the architecture of the camera. The built in level helps retain crispness on the shots.Still photography: Truly remarkable and sharp pictures. I have not used this semi professionally yet and have used it mostly for family gathering over the holidays for enthusiast shooting. The ISO 50 to ISO 204800 give the camera pretty much nightvision. It's insane. The features on the 28-60 lens are sharp and crisp. It also is quite easy to create a lot of bokeh. It does take some getting used to to ""flatten"" your images.Video: shoots at 120FPS makes for Seamless and incredibly smooth filming. Once again that ISO even in incredibly dimly light areas produced flawlessly smooth filming. It's absolutely beautiful. I can't wait to start using this camera more seriously.All in all, this camera is amazing. It has everything I've looked for as a casual enthusiast photographer. I am learning how to use this camera properly, and am so impressed with what I've been able to produce so far with it."
23,Sony Alpha 7C Full-Frame Compact Mirrorless Camera Kit - Silver (ILCE7CL/S),Smallest and lightest Full-frame camera I owned,5.0,"I was lucky to receive as early Christmas gift the A7c basic kit with the FE f/4-5.6 / 28-60mm lens. I previously owned a Sony a230, that I switched for a ""semi-pro"" compact camera from an other brand.First of all, I have to admit, I am highly satisfied with this impressively ""tiny"" full frame camera. What you have to know before buying: It's a E-mount and FE lens are highly recommended (and pretty expensive but worth every penny you invest in it). If you are a vlogger or that photo is your hobby, but you always felt that DSLR are too big or too heavy, go for this piece of mirrorless art.I am very impressed how fast I got used to the new options, and how easy taking decent picture was. The bokeh with the basic lens is pretty ok and I like how the auto mode was very fast and reliable. I do feel that it's a pretty premium entry camera for beginners who wants to make a serious (or not so serious) hobby out of this camera.I use it essentially for my Instagram content or for some other personal/professional projects too. I do miss something from it. Due to its size, one of the control dial is missing. I like to have one on the front of the camera.My lens selection is the following (hobby, dog lover and astrophoto lovers with the basic kit lens set):- The light telephoto option - Sony 70-300 mm, f/4.5-5.6- Astro photo and wide angle: Sony 24 mm, f/1.4I am now feeling that I have to invest in new lenses especially for astrophoto. I will update the review after the next hiking session I will do with my new Sony 24mm f/1.4 ."
24,Sony Alpha 7C Full-Frame Compact Mirrorless Camera Kit - Silver (ILCE7CL/S),A full frame beauty hidden in a compact body,5.0,"There is a lot to be said about this camera. It has the full-frame goodness incorporated in the form factor of an Aps-c body. That means you are more likely to carry it with you everywhere, especially when traveling. Being a full-frame you have the ability to purchase some really nice Sony lenses, of course, some of them are really big and would make this not as compact. The viewfinder is just not pleasant to use. A compromise when trying to trim everything down. I love the articulating touch screen! If you want to make a 4K video on Youtube this is perfect. If you want to vlog on the go then you might prefer a wider lens but that would make the setup a bit heavier and clunkier. It can be done though. The menu screen does not have touch functionality. When closed you can have the screen facing inwards so as to keep it safe. The menu system is the older version, who knows if they will update to Sony’s newest version. It is missing a couple of dials and buttons: No joystick and most of the buttons will have to be used with your right thumb. It only has 1 SD card slot, a bit of a bummer if you wanted to use it as your main wedding or gig camera. Great autofocus and they were able to pack-in IBIS into the body, impressive for the size. This is really where I was floored, the camera helps you not miss that shot or keeps it from being blurry. Love that! Battery life is awesome. You get weather sealing, just make sure the lenses you purchase have that feature as well. I easily transferred files over to my smartphone via wifi/Bluetooth that the camera offers. Overall, this is a very nice camera for traveling or if you really want and need the articulating touch screen. You are going to have to spend a premium for that though. You are paying for the image quality of a full-frame sensor and the compact size versatility that the other Sony models don't offer. After seeing the images this camera produces, even the JPEGS, you will probably fall in love with it as I did. I added some straight out of camera jpegs. I received this product at a discounted price in exchange for my honest opinion."
25,Sony Alpha 7C Full-Frame Compact Mirrorless Camera Kit - Silver (ILCE7CL/S),Best Camera for Your Lifestyle,5.0,"Best Camera for Your LifestyleThis is the best camera for recording your lifestyle and express yourself. Sony Alpha 7C is the most compact full-frame mirrorless available in the market. Its lightness and well-balanced body help you carry it wherever you go without any second thought. Its uncompromising capability and quality let you obtain the highest quality images and videos anywhere and at any moment. I would recommend this camera for people who want to upgrade from crop body, serious about recording your lifestyle, content creator, professionals who need a second body.Swivel screenThis is the second Sony full-frame camera with an articulating screen. Another one that has this screen costs much more. It changes the game in the sense that you have much more freedom in your shot angle and also monitor yourself for the self-shot without any other accessories.Sony Auto Focus TrackingAutofocus and Video focus tracking are out of this world. You will not sacrifice shots that are out of the focus. Especially, Auto tracking enabled in the video makes this camera best for the Vlog. The enhancement on the screen brightness is an upgrade from a7m3. Some suggest viewfinder is a downgrade, but I had no problem with it. I also like how detail you can adjust focus transition speed to make it more cinematic. I wanted it to have an updated Sony menu system, but it has the previous generation touch menu system with a menu button in a weird location.Video reliabilityThis is also a great camera for video recording with unlimited video recording minutes. You can make a professional-quality video for any type of conference or lecture. I see this can be even a great sub-camera for the professionals to have that reliable second and third view of the recording.New Compact bundle LensSony created a new FE 28-60mm F4-5.6 compact lens to go in hand with Sony A7C. I took several shots with this lens and it was a pleasant surprise. I usually do not have any high hopes for the bundled lens and especially the small lens. However, this produces great quality images. The compact lens size and lightness draw you to use it more often than you think."
26,Sony Alpha 7C Full-Frame Compact Mirrorless Camera Kit - Silver (ILCE7CL/S),"Full-frame photos in a super compact body, as amazing as the quality lenses you put on it",5.0,"I own the much more expensive Sony a7s III for video but upgraded from a Sony A7 III to this A7c for photos for the resolution. That resolution is big enough to crop in on things like the moon without much quality loss. I think this camera is an amazing compact replacement for the a7 III. With quality lenses you'll get amazing results! The included photos were all with the 100-400GM, some shots with the 2x teleconverter.The only 2 major drawbacks to this camera is that it really should have 4k 60 video at this point. It should have also received the nicer new menu system as the a7S III as it was released after it. I don't think those are deal breakers, since I couldn't rate 4.5 my rating is 5 stars."
27,Sony Alpha 7C Full-Frame Compact Mirrorless Camera Kit - Silver (ILCE7CL/S),This is a superior full frame camera in a small package,5.0,"I love this camera and have used it for landscape, flowers (with the Sony 90mm macro), and running children (with the Sony 85mm f1.8).  The autofocus is top of the line and the eye focus is excellent too.  Even the kit lens, the 28-60mm that comes with this camera, is surprisingly sharp and very useful.  Really a great job Sony has done putting a big sensor in a small camera."
28,Sony Alpha 7C Full-Frame Compact Mirrorless Camera Kit - Silver (ILCE7CL/S),Looking for your first full frame camera? Look no further,4.0,"Stepped to this camera from a Canon M50 and man was it an incredible upgrade! If you're like myself and didn't want to go all out on the latest and greatest any of the brands have to offer, then this is a great ""budget"" alternative. Yes $1,800 is still a lot of money, but it's the cheapest full frame camera you can buy new. I'm primarily a video shooter with the occasional photo shoot and this camera is really a fantastic for hybrid shooters. After using this camera for a few months, I see why people rave about Sony image quality is absolutely amazing and is plenty of camera for beginners to not only start with but also grow with!"
29,Sony Alpha 7C Full-Frame Compact Mirrorless Camera Kit - Silver (ILCE7CL/S),Light weight and excellent new compact zoom lens,5.0,Light weight and excellent compact zoom lens. Excellent autofocus. I own an A9 and the A7c is very very good. If you value light weight and sharp pictures you will love it. Be advised however that the viewfinder could be better and you will need to adapt to having fewer physical controls - not a problem for me.
30,Sony Alpha 7C Full-Frame Compact Mirrorless Camera Kit - Silver (ILCE7CL/S),The Perfect Camera,5.0,"This is the perfect all-around camera and lens setup for me. I like to be minimalist with my tech, and I found that this camera is the smallest one that can do everything I want, and everything I imagine most people could want. It's got a mic and headphone jack, it's full-frame, weather-sealed, has a touch screen, no known major overheating issues, no video record time limit, good battery life, just perfect for me. I bought the body only, but actually bought the kit lens on eBay afterward because I read up about it and it's actually awesome (I don't usually do kit lenses which is why I initially didn't buy this one). Thanks Sony for making this camera, it's a move in the right direction for sure. Thanks for packing so many features into such a small body."
31,Sony Alpha 7C Full-Frame Compact Mirrorless Camera Kit - Silver (ILCE7CL/S),"Does everything required, and does it extremely well.",5.0,"Like:  Incredible battery life, fantastic low light performance, vibrant colors, fast focusing, & reliable motion compensation, +Viewing Screen flexibility.Dislike: menu - Sony, please fix this software ASAP!  Also, the body is thicker then the APC bodies,  this is due to the full frame & back screen, but be aware it is not as ideal as the APC bodies."
32,Sony Alpha 7C Full-Frame Compact Mirrorless Camera Kit - Silver (ILCE7CL/S),"Compact, Quick, Stunning IQ",5.0,"Upgraded from an a6000 which has been regulated to overkill webcam. Absolutely a joy to use, extremely quick autofocus and the video capabilities are second to none. Full-Frame in a compact body, and the pictures are stunning in both JPG (Sony color science on this model is great) or RAW."
33,Sony Alpha 7C Full-Frame Compact Mirrorless Camera Kit - Silver (ILCE7CL/S),"Compact, full frame and amazing auto focus  system.",5.0,"Pros:- Quick and accurate auto focus system- Great Image quality even with the kit lens.- Image quality handles very well in  Low light environment.- Unlimited video timing.- Full frame camera in small body, great for traveling.- comfortable ergonomic grips.- Sony solid build quality. It will last for many years.Cons:- Only 1 custom function button.-"
34,Sony Alpha 7C Full-Frame Compact Mirrorless Camera Kit - Silver (ILCE7CL/S),O WOW,5.0,"This was our first full frame and also expensive one we own , I just love it a lot ...I am just learning in a senseso i am really very glad and happy to bought this one so thanks ...."
35,Sony Alpha 7C Full-Frame Compact Mirrorless Camera Kit - Silver (ILCE7CL/S),For the professional and hobbyist it'll work wonderfully,5.0,"Picture quality is brilliant, auto focus, and manual features work seamlessly. The included sony battery has incredible performance, especially when it comes to drawn out 4k videography. There is an automated time lapse feature, and for those looking for a solid camera with 3 easy to set manual modes look no further. It's exceeded my expectations."
36,Sony Alpha 7C Full-Frame Compact Mirrorless Camera Kit - Silver (ILCE7CL/S),"Awesome Camera, but the touch screen could be a little more feature rich",5.0,"Took this to Disney world with the Sonny G 24mm f2.8 compact lens, and it was absolutely wonderful. After dialing in the quick settings, I was able to capture every moment I wanted."
37,Sony Alpha 7C Full-Frame Compact Mirrorless Camera Kit - Silver (ILCE7CL/S),Very bad purchase,1.0,Amazon used condition  : Camera components  inside was wobbly there was scratches and dents on it same as well couldn’t get it to take pictures
38,Sony Alpha 7C Full-Frame Compact Mirrorless Camera Kit - Silver (ILCE7CL/S),Awesome!,5.0,Awesome
39,Sony Alpha 7C Full-Frame Compact Mirrorless Camera Kit - Silver (ILCE7CL/S),My first full frame camera… wow!,5.0,"Upgraded from a LX10 Panasonic and couldn’t be happier. The A7C is a great full frame camera for a beginner/hobby cinematographer like me. There is so much to learn from the deep MENU, and I’m looking forward to it!"
40,Sony Alpha 7C Full-Frame Compact Mirrorless Camera Kit - Silver (ILCE7CL/S),Great camera.,5.0,The best camera I have ever owned. Arrived new with no problems. Thanks Amazon for a good price.
41,Sony Alpha 7C Full-Frame Compact Mirrorless Camera Kit - Silver (ILCE7CL/S),"Low screen resolution, bad grip, excellent 4K, fastest autofocus, small body",4.0,"Low screen resolution, no touch screen, no ergonomic, bad grip, excellent 4K, fastest autofocus, small body."
42,Sony Alpha 7C Full-Frame Compact Mirrorless Camera Kit - Silver (ILCE7CL/S),Awesome!,5.0,I am 100% happy that I got the A7C.  The compact design makes it easier to carry around all-day.  I highly recommend this camera to anyone looking to get a full-frame camera.
43,Sony Alpha 7C Full-Frame Compact Mirrorless Camera Kit - Silver (ILCE7CL/S),Amazing Camara,5.0,One of my best purchases. I really recommend this Camara for people that are getting serious into videography or photography. Or even if you just want to blog!
44,Sony Alpha 7C Full-Frame Compact Mirrorless Camera Kit - Silver (ILCE7CL/S),Missing parts,3.0,"Great camera, however it arrived with several missing parts in which i couldn’t use the camera right away."
45,Sony Alpha 7C Full-Frame Compact Mirrorless Camera Kit - Silver (ILCE7CL/S),Powerfull camera,5.0,"This is incredable photo camera. I'm absolutely in love with.The compact size, convinent controls, full frame, beautifull design..."
46,Sony Alpha 7C Full-Frame Compact Mirrorless Camera Kit - Silver (ILCE7CL/S),Great,5.0,"Great compact camera, easy to carry and fast focus on baby."
47,Sony Alpha 7C Full-Frame Compact Mirrorless Camera Kit - Silver (ILCE7CL/S),Compact is win,5.0,Pro camera in compact size
48,Sony Alpha 7C Full-Frame Compact Mirrorless Camera Kit - Silver (ILCE7CL/S),Nice product,5.0,"Compact, lightweight and excellent quality."
